profile_id,profile_text
-1500,"I am a big foodie and I love trying new places, restaurants and things to eat. I love to travel but I also work for a major airline at the airport!"
-1499,My name is Kelly and I am a natural born entrepreneur. I truly love all that it has to offer. I love to travel and take advantage of the many things our space has to offer.. Being able to offer beautiful rooms with all amenities and comforts is not something I would ever compromise on.
-1498,"Married to the love of my life who is a doctor.  I love to travel and meet people from all over the world.  I'm interested in art, books, movies and movies."
-1497,"I am open minded, honest, clean ,fun and clean person with a really good sense of humor and I like to give a good impression of my  business to my guests from other parts of the world."
-1496,"My name is Beth.  I have lived in Brooklyn, NY all my life.  I'm a mother of 2 beautiful children, & a business owner.  I love traveling & spending time with my family & friends."
-1495,"Husband & wife; started as Airbnb hosts. We love traveling, movies, skyshow, fighting, fitness, outdoor activities, bikes, foodie spot, new experiences, new places!We have experience with Airbnb hosts from multiple countries, so we understand the journey an host goes through to make your stay wonderful."
-1494,"I am an easygoing man and if it suits your needs; I will go above and beyond. One day, I hope, our traveling physician plans to visit every nation that is yet unknown to science."
-1493,We are longtime residents of Houston. We love our city and are excited to share it with people from all around the world.  We look forward to sharing an experience with you and your family. Welcome to Houston!
-1492,Hi! Thank you for checking out my home.I bought this unit in December 2018 with the hope of opening this other unit to guests during their short stays. So far so good!I hope you enjoy the space!
-1491,"I'm a proud mother of three great kids and a lovely husband, I have my own business. I love traveling, practicing yoga, watching Grey's Anatomy, and being home with my 2 young teens"
-1490,"I'm an entrepreneur from the so-called Silicon Valley of the US. I am originally from Canada and of course speak fluent English and French. I work for myself, so I go by a 'no media' policy but do social media for clients and on sites such as Facebook, Twitter, and of course Airbnb."
-1489,"I am an art student and painter with a love for travel, the outdoors and raising a family with my husband, Juan. We both work full time, but are down to earth and enjoy traveling whenever we can. We love interacting with new people and introducing ourselves!"
-1488,"I love San Diego, Mexico,  L.A., northern CA, and the Pan-Pacific Coastal regions of the Southwest.  I am a corporate relocation specialist with international shopping sites.Born and raised in San Diego."
-1487,"Slightly old, slightly old at heart but very much a fresh, new era of life!! I love cooking, travel, reading, creating and hanging out in nature with family and friends!!!"
-1486,"Originally from Italy I lived in the US for 11 years, grew up and am still together with my family. I work as a masseuse in LA and I am using the money I make from this service to travel and see more and more of the world.Also I found Airbnb because I love the Airbnb community!"
-1485,"Simple folks who share a passion for travel.  We love to host our friends and guests in our home, to bring peace of mind for them during their adventure and to be able to really enjoy their stay."
-1484,We are an eclectic duo that enjoys life to the fullest. I am a natural first responder and champion for humans and pets. I have a full-time position. I love coffee and I know you do too. I am open to food and wine with no drugs or drinking. I love movies and I grew up reading books.
-1483,Hello there! Thank you for your interest in my home. I am a very friendly host. I work on weekends but am always available to answer any questions you may have. I will try to make your stay as comfortable and pleasant as possible. I hope you are proud to call my home.
-1482,"We are graduate students studying business at USC. We love meeting new people, exploring the rich culture of places we visit, and eating the best food. We are music lovers, and yet we're mostly vegetarian. We love to travel and we're very active on the local pool scene."
-1481,"AirBnB for 'new' travelers: traveli comes to Nashville (TN) in January 2019 and meets the new people traveling to our great city. As you will soon discover, when someone can stay at their home - they can stay at yours."
-1480,"We love traveling with our family as often as we can and we enjoy hosting guests from all over the world on our home, so please reach out to us if you need recommendations to go places we aren't able to go."
-1479,"I have been living in SF for almost 40 years. I go out of town a couple times a year, and I think I need to rent out my house to split time between my kids and I."
-1478,"I'm Anish and I live in Chicago! I love to travel and I also love hosting people, I have a great team of employees that go above and beyond to ensure your stay is wonderful. Come visit me and look forward to meeting you."
-1477,"I am a mother of two wonderful grown up kids. I am from Illinois but lived in Texas (St Bernard Park, near Morgan Park), Arizona, and Colorado. I work from home, managing apartments for three years and am new to Airbnb. I enjoy traveling and enjoy hosting.  I love staying active and going places that are far away from home."
-1476,"Yes!   I am a licensed Las Vegas real estate broker, and I am an Estate Broker in California!I am a friendly, outgoing person that is courteous and accommodating.  I love doing home improvements on my residences.  I enjoy sharing a little of my home with people from all over the world.Look forward to meeting you in Las Vegas!!!"
-1475,"We are a warm, friendly and fun couple from Austin, Texas. We love traveling, exploring new places, and sharing food and places with others. We use AirBNBs a lot, when we travel to new destinations."
-1474,We are two non-smoking artists and an avid traveler. When we travel we like to have a custom travel experience that combines all our favorite things. Instead of just a night in a hotel room we host a club and wine tasting event to experience the culture of the city we're visiting.
-1473,"Hi!I'm Rachel.I'm a genuine fan and living my best life with all this, I've a good idea of what makes others smile and glad. I love hosting and meeting new people. I love spending my time reading, eating and traveling. I love to host and I love to help you make this your favorite place on earth :)"
-1472,I live in west lon ve with my family and love the beach and nature. My background is in hospitality and interior design so we are giving suggestions for activities and relaxation spots in the area.Welcome to one of the best places to stay!
-1471,"I am a retired REAL ESTATE Broker and just moved to Las Vegas from OKC to be closer to my grandchildren.  I have been renting out my spare rooms for several years now, and have been a very good host.  I hope you feel at home in my space. - Marlene"
-1470,I'm a health-food enthusiast who enjoys traveling around the world. I live pretty simply and LOVE the quiet and quiet peaceful feel of my place. I'm always happy to make suggestions asI'm always eager to meet new people!
-1469,"I am a normal, down to earth person who love to eat, drink and be merry. I always prepared something from scratch to enjoy and consume in the restaurants that I frequented. My bar  is a private establishment that is very spacious and well kept."
-1468,"I'm a single father of a 12 year old twin boys. I'm passionate about the arts, always working in the field and passionate about supporting the area artists and fine artists in my local community.  I love to dance, hike, and otherwise indulge in outdoor activities."
-1467,"I am a little laid back, married, and love entertaining. I love to travel and I have hosted international students for international students in the past.My mom, Ximena, and I always appreciate people!"
-1466,"Plantronics and Lawn and Garden are the tenants in my beautiful rental homes and catering to individuals in Jacksonville and Long Island, New York, for the past 15 years.  We hope our rental homes and spaces are welcoming and we pride ourselves on providing personalized, high-end service to our guests and strive to exceed the expectations of our customers."
-1465,"I'm an artist, and my career has really taken off since moving to Tucson. I moved here from the East Coast 20 years ago, and have truly gotten to know the region and my surroundings."
-1464,Me and my girlfriend go traveling everyday.  As tourists we understand what a backpack is and how to go about it.  Travel is life and we want to enjoy our time getting to know the place and making memories.  Hope you have a wonderful stay with us.
-1463,I am a designer/architect who works in the construction industry.  I love traveling as well and I'm passionate about using airbnb when I travel.My life's motto is ' To each one according to his labor; unto each according to his work.'
-1462,I was born and raised in Hawaii but have lived in the Seattle area for the past 20 years. My husband and I have a son and a daughter. The family loves to travel and has had an apartment in Nice France for many years.
-1461,We are a Family Owned Air B and B x Bed and Bath as well as a Management Company. We own we Villa as well and host a collection of Villa's from around the United States as well as the Coast of Mexico.
-1460,"We are a couple with a joint allergy & asthma and love walking around the high desert of Tucson, Arizona. We're have live here for more than 30 years and own a small hospitality business."
-1459,"I am a mother of two adults and father of 4. I am an entrepreneur and love business.I'm originally from New Hampshire and now reside in Hendersonville, North Carolina."
-1458,"I am a general contractor and automotive engineer. My wife, Tara, is a cosmetologist and we have 2 kitty cats: Tyson and Mitchell. We love to watch movies and eat out and are happy to share our home with you."
-1457,"Hi! We are Sun & Moon Luxury Retreats. Our mission is to create blissful, simple and genuine environments that bring out the best in our guests. We hope you will find our homes a delight to stay in and feel at home."
-1456,I am a world traveler who travels with family on business and pleasure.I'm originally from NM and I moved to LA in 2013 to be closer to family.  I am the oldest of three and have a gorgeous son with crazy hair.
-1455,"We are a clean and laid-back couple. We love to have adventures with friends and family. I work for a non-profit that provides clean, safe and affordable housing to low-income residents. We are easy going, but respectful of others and their space."
-1454,"We're from Argentina, have lived in the Houston area for a few years and completely fell in love with this place. We moved to Fort Worth at the beginning of 2016 and fell in love with the surrounding places. We like going hiking, go golfing, go sight see, eat out and relax at the beach."
-1453,"I am a chef, originally from Nigeria. I have lived in Portland for nearly 25 years. I own a restaurant in Washington state. I have had the pleasure of hosting at my guest house in Hyde Park for over 10 years. My goal is to make your stay memorable."
-1452,We are a couple who loves to travel!  We have stayed in many AirBNB properties and have truly found the best.  We look forward to welcoming you and sharing the best of Austin with you!
-1451,I am a CPA in the tax and property planning field.  Originally from Omaha Nebraska but moved to Charlotte NC at the end of 2013.   I like being around nature and people.  I also enjoy hosting events for friends and family.  My motto is to enjoy life to its fullest!
-1450,"I'm a film producer, musician and self taught moto-moto rider. I love the outdoors, good food, free time to read, walk, exercise, suntan, hike and travel. My wife, Jan, and I have lived in South Austin for over 20 years and speak 5 languages. We enjoy taking on the backpacker trail."
-1449,We are Filipinos living in the US. We love to travel and meet new people . We love to eat well and live happy. We hope you will enjoy your stay with us in Albuquerque.
-1448,"I am a Southern gal who loves to spend time with my family.I'm handy with a knife, handy with a hammer and enjoy other types of outdoor activities. If we have a special occasion it is a party in the middle of nowhere."
-1447,"Hi, I love traveling and meeting new people. I have been in the hotel industry for over 10 years but recently have started my own boutique hotel. I designed and built my boutique hotel to cater to all tastes and interest.I'm excited to be a part of the Air B&B community and I look forward to hosting you."
-1446,"i have been living in  18th floor upper floor for 12 years & enjoy meeting new people.i love to make people feel right at home.i love to go out and eat, walk, read, & spend time with friends & family. i am active and love running and biking."
-1445,"The property in question is a beautiful great home in Peoria, AZ .   Easy access to I-40 and Phoenix area.   Close to the zoo and AT&T road.  We love to travel and we are so excited to share our beautiful home with others that travel with us as well!"
-1444,"People and a little hobo that I share my home with.  I really do enjoy hosting travelers from all over the world, it’s something I've always loved to do. Bringing a little color to my home and giving extra love to my home, I hope you get a little memento of my adventures!"
-1443,"I am a retired 72 year old teacher.  My husband of 62 years, (clayton), and I love travel and our home.  We use Airbnb for our home since we both love the lifestyle.  We live in Northeast DC, with our dog (Ruby), cat (Cassandra), grandson (Kendrick), and four little kids (who are now grown)."
-1442,"I'm a young, active professional that enjoys traveling and activities all around the world.I'm a large space traveler and would like a safe, peaceful place to stay. My family is my top priority and we try to treat our guests right. We have found a home that we love and hope you will too!"
-1441,"Hello,I'm the property manager for this apartment. I am a local B & B Agencies. I purchased this multifamily residence in 2014. I have a full time Maternity/Womens Care Gyn. I am looking forward to hosting you."
-1440,"I am a musician and a mother, I have 3 kids , a 4 year old, 14 month old and a 1 year old. we love traveling and meeting new people we are hoping that we can make a difference in people's lives by making their travels and stay more fun and safe for them."
-1439,"We are fully-flavored people looking to spend the most part of our time in our beautiful, calm home and we greatly appreciate that others would like to host our home when traveling or exploring the world. In that respect, we also take pride in the level of service we give our guest."
-1438,"I would love to be a great host. I'm an outgoing old hippy male that lives easy and happily with his beloved Rugrats. My wife, Pam and I love to travel and are always trying to get away from home. We are looking forward to more adventures together and meeting new people! And we love hosting :)"
-1437,"Astronaut, Mother and Creator. An artist, Former Capri Intern, current Test Pilot. I am also a skydiving instructor. I love to travel and have been to over 27 countries and counting.  If you are looking for a reason to visit, I have lots of suggestions!"
-1436,"Hello!  I work in higher education,  I'm originally from Queens, NY but raised in Cuba before moving to Tucson in 1990.  I also have an incredible daughter and brother.  I enjoy reading, programming, traveling and meeting new people."
-1435,"Family fun, love to love life, we like to be out and about as much as we can be. My husband is retired and we both enjoy travelling and being outdoors."
-1434,We are a family of 6 with a home office and a professional line manager. We are active in the Charlotte community and socialize with our neighbors all the time.
-1433,"I am a single mother working hard to become a faculty member at the City College of Denver. I love being outside, the great outdoors and creating a beautiful, safe and cheerful atmosphere for the people who visit the Denver area."
-1432,"I'm a traveler. I love the idea of a home, so I want to share my home with others. I'm social and I make friends easily. I like to laugh and be social."
-1431,"We are Mark and Sandy. Born and raised in Southern California, but reside mostly out of our state of California. Nickname is 'Guy 3' I'm the guy with the mystery Airbnb handle. My nickname is probably a little cheesy, haha."
-1430,"Danni and Jason are the owners and operators of Modern Meadow Single-Family Home Park on Downer Terrace. We are close to all the town of College Station has to offer, and our exotic garden is also great for enjoying.We enjoy doing weddings and parties in the luxurious atmosphere of our pied tent, furnished living space."
-1429,"Marcia and Roy are hosts in West Berkeley, CA.  We have lived in Berkeley for 30 years and enjoy sharing the beautiful City & the nearby beaches.  We're a  polyglot and know the best places to eat, drink, and explore the area."
-1428,We are a husband and wife (not related).  We met in Atlanta and brought a daughter to our house.  She is now 6.  We’re here for all y’all.  We’re here if you need help with anything in the house!
-1427,Stephen W. is a professional who works in the film and television industry as an editor and makeup artist. He is originally from Minnesota and has lived in Los Angeles for the past 28 years.
-1426,"Recently moved from San Francisco to the beautiful Boston area. I live with my mom and sister, but have been here for 6 years now. I love music, food, travel, sunshine, travel... always looking for local spots. I really enjoy hosting."
-1425,"I am a man of many things. I teach, I earn a living. I take pride in my home and I love my family. I have had every service station on this property serviced since my wife and I purchased it. And it came out like new."
-1424,Very humble professional working in educational technology. Enjoy traveling to the Caribbean and at the end of the year like to learn about new food and new places to eat in new places. Also love to spend time with family and friends.
-1423,"I am a 5-star Airbnb SuperHost in true Bel Air style! I put the guests first and work for a fantastic company called 'SpaceFILLED'. Anyone with an Airbnb account, can book with us and get FREE SHIPPING around the US or the world!"
-1422,"I am an educator at a public high school.  I speak Spanish and speak little English.  I love to travel, hike, and explore, but also live by the Golden Rule - treat people the way you want to be treated!"
-1421,"I am a midlife professional and mother, who lives for the mountains in Cresson CA. We want to create a cozy environment to welcome you to an Airbnb and enjoy your stay."
-1420,I'm an airbnb host and frequently use airbnbs. We have many properties that serve as «adavantages» to our home that provide space for vacationers to relax and unwind with friends and a movie.
-1419,"I own a photography production company and also do photo seminars all over North America. My photos have been published in Vogue, Spain and Laura Zielins Photography Magazine, Australia. I am so satisfied with my company I opened a gallery in my home."
-1418,Hi I am Leigh.I like meeting new people and traveling to different places.I'm work full time.I'm very sociable. I also love the ocean.I'm way too tired so please dont sleep in the bathroom :)
-1417,"I am former Naval employee who loves learning about new places, new experiences, new people, new ideas and new places to visit. I love to travel and to explore. I am an avid outdoorsman and conservationist.   I grew up on the East Coast in a low-key family but I love to explore."
-1416,I am an ESY scholastic (education specialist) educator in the Detroit Public Schools. I recently graduated as an associate from Wayne State University with an Edgemont Leadership School of Education graduate program.
-1415,"My name is Robbie. I have lived in Nashville for 15 years. I graduated from Sam Houston State University with a degree in biology. I love to work out, read books and watch basketball. I'm only half English. My second language is Italian."
-1414,I am a  Public Relations professional working in the education field.      My goal is to help parents with their child stay. I will go above and beyond for my clients.    I pride myself on providing excellence at a good price. I live by my word! You will always be able to speak to me.
-1413,"I was born and raised in South Texas and I love it here. It is a very loving place. My hobbies include fishing, blacksmithing, fly fishing, and other outdoor activities. I love to travel and hope to travel much more."
-1412,I love traveling. I don't get to do a lot as a non-offical house guest except for work travel. I'm frequently traveling for business. I'm a Grandmaster of dog agility and rabbit agility and I'm doing individual agility. I love competition and physical activity. I was trained by Marcel Guipichon and he's now dead so I figure I'll keep practicing.
-1411,I own a small renovated interior design company called Casita 15 and own an 80 year old building in Canoga Park! I love to travel and especially get to see the world!
-1410,I am a person who loves to entertain and likes to create and create while entertaining.  I am a chef and have done a lot of traveling as well as hosting. I love having people around and encourage that they share a lot of great things about this area with us!
-1409,"Hi I'm Evonne..I'm a very sweet , fun , and friendly lady..You will enjoy your stay in my guest house..I have lovely home and would love you to stay here if you are visiting Phoenix area..Your  on the easy . Check out my life on (Hidden by Airbnb) Feel free to contact me anytime if you have any question"
-1408,Hi my name is Mark!Nice to meet you!I love to travel and host :)I am open and honest with my guests and use very high quality standards in my home. I look forward to hosting you :)
-1407,Hello Airbnb!!! I love traveling and trying new foods. I'm a US Navy Veteran and Single father. I really enjoy meeting new people and I look forward to seeing you at my home :)
-1406,Live at home on beach and spend the time when I travel. Vegan/Vegetarian. Love the outdoors. Chubby 3!P.S.G was 2 years ago!The space looks from a 3 minute drive but from the guest space!
-1405,"I'm a family oriented person. I enjoy a large social circle of friends. I love to be out with my family, cooking for friends, day dancing with friends, travel and spending time with loved ones."
-1404,Hello I'm Cody this is Anette and in my opinion you wont regret making a reservation with me. I'll make sure your stay here is second to none.Because of this I'm offering this as an affordable alternative to owning your own home. Rentals can range from $50-$60 with discounts over 50%.
-1403,"I am a retired medical school professor, and my husband, Arthur, is an artist and architectural draftsman. We love to travel and we love good food.  We have two children and a grandchild."
-1402,Hey there! My name is Sarah and I am an editor here at Vice. I love traveling and hope to be my hosts as much as I am yours in this space. Please let me know how I can help you make the most of your time in San Francisco. Cheers!
-1401,"My name is Jordan McKelvey, and I live in Arizona with my wife and 4 children. I have been a realtor for the past 13 years in this great area of Arizona called Historic Eileen. I enjoy traveling, skiing and snowboarding on the awesome Great Arizona Trail, and spending time with my sweet husband."
-1400,"We're long time Floridians and Chicagoans, so we look forward to hosting you in our home.  We moved here a few years ago, just loved how great this city and neighborhood is (see house photos!), but have also continued to enjoy its fascinating history and flavors."
-1399,I live in Atlanta and ride my bicycle most of the time. I am also one of those hip and flexible people that go out of their way to make sure you have a comfortable stay.
-1398,I'm a native Oregonian. I love Eugene and love to explore new places. I've built many of the houses in Eugene and I love to take my boat on the Willamette river.
-1397,"I have lived in Nashville for my entire life. I am an easy going and easy going very down to earth person. I enjoy meeting new people, driving new cars, experiencing new things,  and indulging in new experiences. I thrive in travel and would love to host on the weekends."
-1396,I am a medical student who's excited about his studies. I love to travel and meet new people.I also love sports. I have a great roommate who helps me fix my bikes.
-1395,"Greetings!My name is Scott and I'm the owner and operator of Moon Shoes and I work closely with Scott, Kaylee,  & Matt when it comes to leasing our homes to guests.You can usually find me out and about enjoying our condos or hosting coffee meetings and live music with our great team."
-1394,"I work as a social worker in state government in NJ.  Our lifestyle in NYC, we live like gourmet. If we are hosting an event, I'm the one to put ingredients in a dish and make my guest look professional and caring!"
-1393,"My wife, Marisa, and I are Vancouver natives and therefore familiar with the area. Our nice spacious detached home (next to our guest house) is now available as a very special opportunity to come back to this beautiful city."
