profile_id,profile_text
-17,"Hello,  we are Somadeep and Parameshi Sadiq. Our brand new house are in a culturally rich yet incredibly diverse neighborhood. For the past 3 years, we have been taking advantage of the fabulous local amenities the neighborhood has to offer."
-16,I am a Community Man who loves meeting new people.I understand how important it is to feel at home when you travel. I am an Experienced Host and as such will provide you with a very top notch and meaningful Airbnb experience.
-15,"We are active couples living in paradise. We enjoy sports, art, meeting new people and exploring the world.  Our hobbies include film, travel, and skiing! We enjoy hosting and trying new foods."
-14,"Hello, Im Edna, I love people. I was born and raised in Arizona. I love the desert for its amazing views and its warmth. Its a truly unique place to live. I am happy to help you explore this wonderful town."
-13,"I love traveling and hosting guests from all over the world. I travel on budget andI'm always home to take care of any needs and concerns. I love cooking and entertaining and have hosted people from all over the world. Looking forward to hosting you and making your stay in Los Angeles to be comfortable, Davide"
-12,"I'm Bryan and I am the co-founder of StrongFirst. We enjoy finding quality businesses to help local small businesses grow. My background is in insurance sales and marketing. I enjoy hosting on Airbnb and watching as good businesses, small and large, get started."
-11,Arriving in Europe 6th month we decided to explore new places to stay.  We were lucky to find such superb places and always loved the view from the top as we climbed the wall of the hotel.
-10,I like to travel andI'm starting my 5th month of hosting. I live in the Irvine and seattle area. I work as a Mechanical Engineer. My favorite travels are to Brazil and South America.
-9,"I am the owner of this investment property.  I don't live at this property, so I rent rooms there.  I am opening this property up to fellow musicians and am looking forward to hosting."
-8,"I was born and raised in Colorado. Love to travel. Great job, but also love to work. Excellent read selection, but also love movies. Enjoy walking, reading, and going to new restaurants. Loves to host and I can't do without compliments on a nice little place to stay."
-7,"Hi, I am Karson! I am a college student and single mom. I love meeting people from all different walks of life! I work full time as a teacher and love what I do. I also love to travel. I stay busy, learning new things and getting inspired to achieve my life's goals!"
-6,"Just a lovely God-filled, organized, friendly couple looking to provide our fellow Airbnb travelers with a beautiful happy home. If you need anything at all, we are looking  pretty much  open-minded!"
-5,I am a Realtor working in the DC area. I have over 200 properties and have relocating to space. I work as a 'protector' for people renting out their townhouses. I make sure that the other homes are well taken care of
-4,"I am an environmental consultant in the  natural resources and hospitality fields and with my partner we own and operate a couple of vacation rentals throughout south san diego. We love to travel when we can, currently exploring new places and places to eat."
-3,"I am a professor of psychology at the University of Montana-Bozeman, and my husband, Matt, and I have lived in California for 8 years now.  We love to travel and would love to share the pleasures of our city with our guests."
-2,"We both grew up in Southwest Washington, in the Washington University suburb of St. Louis Park. We purchased the duplex in Petworth for our new space in January 2018.Hans is from Germany, and Joanna is from England. We are now enjoy sharing our home with airbnb guests."
-1,"I love traveling and meeting new people. My hobby includes theatre, songwriting, and learning new things. I'm excited to share my home with you and would love to share adventures while I am away."
1,"Family of 6 lives in the main home, from toddlers to teens + 2 dogs.   We are generally around in the main house and can be of any assistance you may need."
2,"We are young professionals who enjoy gardening and the beautiful outdoors. We support environmental conservation, love farmers' markets and enjoy science fiction. Doctor Who is our favorite show, and we are head strong moviegoers. Portland has enhanced our lives incredibly, and your time here will surely be treasured."
3,"I live in Nashville Tennessee and love to travel!  I also love nature, animals, and meeting new people from all over the world!  The world is so beautiful filled with hidden gems throughout, you just have to find them"
4,"Stay at The Lucky Duck, a fresh, new gastropub in Fort Mill, SC with upstairs apartments. Enjoy the amenities of a home above a vibrant restaurant in a bustling community. Perks include but are not limited to restaurant discounts & more."
5,"I am a native Baltimorean and registered nurse who loves my community and caring for others, especially in these troubling times! I am especially passionate in providing housing to those on the frontlines of fighting COVID-19, and to those seeking self-isolation!"
6,"We are a husband and wife team working on opening a tiny home inn in Arizona. In the meantime, we want to share our passion for living tiny and minimally with others."
7,"Hi there! I love to travel with my family, I am a professional chef and love to experience cuisine all over the world. My favorite thing to do is to see a little bit of history of where ever I am visiting."
8,"I work at a local hospital. I have 3 dogs, who sleep with me and stay on my side of the house, except first thing in the am when I send them out to potty.I love to travel and meet new people."
9,Craig and Shirley are empty nesters who enjoy people.  Their Midwestern hospitality combined with a well furnished living space makes for a pleasant stay.  Couple this with Shirley's love of baking and fresh bread for breakfast is an everyday treat!
10,"Married for 32 years to the love of my life, Cindy.  I am called 'Dad' by six beautiful children.  I love to travel and meet new people, and experience new cultures."
11,"I am a touring musician, married to an amazing teacher and raising 2 wonderful boys.   Our family loves to travel and with my experience traveling the world and staying in countless hotels and airbnbs, I know just how to make our guests feel special.  Welcome to our cozy home!"
12,"Moved about a year ago back to California from Texas. I love being with my grand children & daughter. Passion in baking, cooking, interior, exterior painting. Enjoy going to the movies, concerts, play some pool."
13,"I am from Asheville, NC, but have lived in DC for 10 years.   I love to spend time exploring DC with my family, cooking, and am always planning for the next home improvement project.  I am available during your stay at anytime!"
14,"Having grown up in Colorado, and lived mostly in the western US, I have been quite happy in the Pacific Northwest for many years. I enjoy traveling on the off seasons when it can get a bit gray."
15,My husband and I are retired.  We have 2 grown sons with beautiful families.  We have been in the rental business for over 40 years.  This is our first vacation rental so we have done our best to make it inviting and comfortable.  We hope you will enjoy our home.
16,"Hello, I have been sharing my home for many years. I am traveling the world and sharing my home whileI'm gone. I have worked VERY hard in renovating the condo and am so excited to finally get central AC system in. Look forward to hosting you!"
17,"47 year old male who loves to travel. Love traveling with my just my wife, or with our kids, or with other couples. I love seeing different cultures, architecture, history and sights. Enjoying time to meet new people, relax and expand our horizons."
18,Born and raised in Hong Kong and have been staying in US for 10 years. I am now living in San Diego with my husband and working as an animator in the video game industry. We love to travel and explore the world and like to meet different people and listen to different stories!
19,"Hello! I first used Airbnb for my first trip outside of the US this year (Japan) and had a great experience.I work full-time at a water district and enjoy what I do.For leisure, I enjoy staying active, spending time with family and friends, and love to eat! I'm looking to do more travelling in the near future."
20,I used to work for the New York Department Of Education as a teacher for 17 years. I have two kids. I joined Airbnb because I like meet people from different cultures. I'm also very friendly and respectful.
21,I am an architect of the future. I work as an artist at the intersection of public policy and environmental design. I create civic spaces of great interest and deep renewal.
22,"I'm a retired professional woman with two small rescued dogs and two cute birds.  Big house, on the beach, lots of room, in a great resort neighborhood. My home is filled with art and antiques. I love having guests!  But you will have plenty of privacy!  There is so much to see and do - it's paradise here!"
23,"I work in IT for the school district. I enjoy running, weightlifting, eating out and all things related to art. I also like to travel several times a year and love meeting new people."
24,"Welcome future guest! We are Curtis, Gen and Josh. Josh is in college and  lives at the property.  I am a nurse and Curtis is in Technology Sales. Our family has adopted the philosophy to focus on  the things we can change, let go of the things we cannot and wisdom to know the difference."
25,"When Halie and I are not working, we enjoy going to movies, concerts, hiking, and sporting events. Most times though, we end up visiting with friends and family on the weekends."
26,"I am always happy to share my home.Hosting is a form of artistic and creative expression that I enjoy very much.I enjoy the outdoors but I especially appreciate warm weather.I love traveling, dinning, shopping, sporting events and live concerts."
27,"I'm an outgoing free spirited person. Who loves clean house and family. I love movies, popcorn and good wine. I write on my spear time and you can find me at a movie release frequently. I'm also a doctoral student at this time."
28,"IGN Realty is a boutique property management firm based in Atlanta and NYC. Our mission is to provide immaculate accommodations in safe, central locations that allow you to take advantage of everything the city has to offer. All of our units are professionally maintained and modernly appointed with all of the creature comforts of your own home."
29,"We're the creative duo Joe & Arielle Pagac. Joe paints murals for a living, Arielle is a videographer and we love to travel in our free time.  We also love to camp, hike, bike and seek new adventures together across the world."
30,"A native of Milwaukee, WI, I enjoy traveling. I'm a marketing account executive for a global company. I live by the work hard, play hard motto. I'm very easy going and need time to unwind and just go with the flow on vacation. My passions are yoga, gardening, live music, drinking bubbly and exploring."
31,My son and I love our island city in the San Francisco Bay. I am a real estate agent and writer. Now that my son is a teen starting to travel more with him.
32,"A lady full of Integrity, loyal, respectful  and have been told Witty and Funny! I love helping and meeting people and providing guidance to healthcare.  Texas is the MEGA for Medical diagnosis and Best Hospitals!"
33,"I am a communications director with two young children. We love our life in Westchester and our backyard is an oasis, while the garage is part art studio, part Lego Minecraft workshop.  Our lives are busy but our home is peaceful and quiet...even the airport doesn't disturb us!"
34,Van and Helen Arnold are very involved in owning and managing their furnished rentals. We take great pride in our homes from remodeling to accommodating guest. We make sure everything is perfect.
35,"My name is Stephanie, I moved to Colorado to enjoy the great outdoors. My husband and I enjoy hiking and running. We recently moved into the house, we have a lovely cat, and we absolutely love the area."
36,My wife Julie and I have traveled to many parts of the world. We are both retired flight attendants who worked for TWA later acquired by American Airlines. Julie speaks french and italian.
37,"We, my wife and I love hosting guests in our home, our rooms are comfortable, beautiful and we always respect the wishes of our guests regarding interactions.  If talking and visiting is your style, we welcome the conversation and if you need your space we completely understand that need as well.  We hope to host you or your family soon!"
38,"I'm a dad, veteran, data engineer, and Scoutmaster.  Have lived in Indianapolis for 30 years, andI'm happy to share my knowledge of the city so you can have the best trip ever."
39,"I'm fairly outgoing, love to read, watch TV, movies, spend time with family and friends and traveling.I do tend to be more of a homebody than out on the town every night.Born and raised in Oklahoma City so I can help provide directions, recommendations on where to eat, what to do, etc."
40,"Love travel, movies and just relaxing with family and friends whenever the opportunity presents itself.Have had great guests at my property and I am thankful for the opportunity to share my home."
41,"I'm an Author, Artist and Activist. I teach yoga & Meditation. I was born in Ethiopia, the land of Coffee and Hospitality. I love to travel, try new cuisine and connect with people from all over the world. Welcome to the Motor City!"
42,"We love Milwaukee! Brew City offers so many things to do, see and, of course, taste! The studio units we offer are guest suites, fully stocked and pretty spacious.  All of our units are located in downtown Milwaukee and within walking distance of a variety of bars, restaurants and grocery stores."
43,"We love this city and think that you will also! Therefore, our goal is to provide a pleasant, comfortable & affordable place to stay when visiting the wonderful attractions of Washington DC. Our motto: Smile at life & it will smile back at you!!!"
44,Born and raised in Hawaii and moved to Washington in 2014. I am tech savvy and like the smart home concept. I just bought a used Tesla for Uber & Lyft. Feel free to contact me if you have any questions.
45,"Hi!I'm Jess.  I'm an SC native and live in Boston with my husband and our pug, Purdle.  By day, I lead a sales team at a technology start up in downtown Boston.  My hobbies include interior design, yoga, reading, and traveling.  I love meeting people from all over the world through traveling and hosting on AirBnb."
46,"Financial Professional from the Denver area. Golf, skiing, hiking and scuba diving are all enthusiastic hobbies of mine. So traveling to places that allows me to partake in any of these is always highly anticipated."
47,"Hey there!! I'm Joy. I'm 44. I've been a waitress for 23yrs and I LOVE what I do! I'm a understanding, good hearted, (very) clean, respectful, loyal and honest person."
48,I am a local Realtor and Interior Designer.  I am well travelled and understand the needs of travelers.I am excited to host you at my homes and happy to assist with any needs.
49,"I am a Lease Analyst for an oil and gas company downtown Houston. Very active; Christian mother of 2 grown children. As an adult family, we love traveling and use Airbnb at each stay.  That allows us to get a first feel of what it's like to be a guest in someone's home and bring new ideas into ours."
50,I used to work as a EMT now work for myself and plan on traveling around to visit family all over. Im a movie goer watch fights love all kinds of music working and going out and family time. My motto is live life like theres no tomorrow because theres no guarantee for tomorrow.
51,"I would say my two favorite things in life are travel and  family. I manage this  property with my brother Vincent and mom Carol(aka ' Momma D'), which is always fun. All we ask is for  people to enjoy our place as much as we do.  Cheers!"
52,"I really enjoy meeting people & learning there stories.  Love traveling, good food, painting, photography, entertaining, movies, gardening, boating, being on the water or in it,  outdoor activities, skiing, walking/hiking, yoga, cycling, dance, music, art, design, fashion, giving back & living in the moment enjoying life, spending time with family & friends!"
53,"Ryan and I love living in the heart of the city and we are proud of our neighborhood. It's walk-able, diverse, and friendly.  We enjoy our local restaurants and the energy that the neighborhood kids bring."
54,I am the owner/ operator of a home organization and food prep. business. I enjoy travelling and experiencing different cultures and foods. I enjpy sharing and  hosting people  in my beautiful home! You have one life.... LIVE IT!
55,I am very passionate about life and sharing it with others.  I work hard at creating great experiences and building relationships with everyone.  I want you to have a wonderful experience in our Airbnb homes in San Antonio.  Designed for today's traveler.  Enjoy!
56,"Hi I'm Enrique, a certified Feng Shui Master and practitioner who enjoys opening his home to solo adventurers, couples and business travelers.  Owner of the Feng Shui Institute of El Paso, i thrive in creating a serene and balanced environment for my guests.  Se Habla Espanol."
57,I am a retired Business Man who loves to go fishing and camping. I love adventure and traveling that prompted me to join Airbnb to share my place to travelers like me
58,"Hi! I'm Lana. I moved to Denver from NYC (previously I've lived in Portland, Seattle, and east of LA) and I work in the bar & restaurant industry. I'm excited to share my house with you so that you can fall in love with Colorado too."
59,"Originally from Orange County. I love to travel. Foodie at heart:) I'm easy going, honest and respectful. I appreciate cleanliness and will treat any home as if it were my own."
60,Andrea and Andy love life in the Pacific Northwest as well as exploring in many other directions.  We are thankful for the many positive travel experiences we've had on Airbnb and are thrilled to offer a space for fellow adventurers to visit!
61,"Dear VisitorsI was born and raised up in Vietnam. I have graduated College in my hometown, since I moved to America in mid twenty.  I decided to go back to school for pursuing Hospitality and Tourism Management program in Portland Oregon, which I really passionate for it, and I have graduated in 2017. Yay!"
62,"I like to travel and explore different places. Also,I have two beautiful kids and husband that I love to go places with and let us enjoy our lives! I love to hang out with people,family and Friends"
63,My name is Marie. I have 3 Children and my boyfriend lives with us. My oldest daughter helps me run the internet part of the job and I help the guest to my capabilities!
64,"Fun and easy going. I like the details in things. I love food and I love being outside. I can't live without, books, music and spring water. I think everyone should read The Alchemist at some point in their life.As a guest, I just need somewhere to sleep and maybe get a cup of java."
65,"Hello I`m Katarinawelcome to my homeas i understand there are many other options you can chose from, i`ll try my best to ensure your 5 star stay here!"
66,"Anna, Polina, and Troy work as a team to provide our guests with the best experience possible.    We work hard and recognize how important a vacation is and do our best to answer your questions as quickly as possible.    Please reach out if you have any questions!   We can't wait to host you."
67,"I am a VT native currently living in Boston with my fiance. We both love to travel and experience new places, food, culture, etc! We also enjoy hosting people in our home so they can experience all that Boston has to offer."
68,"I am a husband, ARMY Veteran, and a registered nurse. Aside from enjoying time with my family, there's not much I do when it comes to partying and night life. I enjoy watching The Walking Dead, NBA, and some football. I am very considerate and communicate well. Any other questions, you are welcome to message me."
69,"A WIDE SELECTION OF Luxury HOLIDAY VACATION RENTALS APARTMENTS AND VILLAS FOR RENT AND SALE. ORGANIZATION OF TRANSFERS AND EXCURSIONS. CONSULTATIONS ON ANY QUESTIONS. MEETING AT THE AIRPORT.I will make your stay comfortable and without worries. Positive, with an active life position. I will organize exciting trips for you. Real Estate Broker. With respect and hospitalityINVESTCONTRACT INC USA"
70,Hosts (Mick and Kristi) reside within minutes of the property and are eager and willing to assist with all your questions and needs.  Mick has lived in Colorado for his entire life and is more than happy to share the Colorado experience with guests.
71,"Retired civil servant, served at US Coast Guard , and US Naval Academy.  After Government service, I trained and worked as an Orthopidic Surgical Technician.  Active in community affairs.  Enjoys history and travel."
72,"We are a married couple, each of us having come to Columbus in the last five years. Rali is an artist and former professional squash player, and Mark a scientist and author of a number of books on his research."
73,"I'm a busy small business owner who travels a lot for work.  But i truly love what I do so it's not a burden.  I decided to list my home due to the fact I'm gone so much.  I enjoy great restaurants, working out, and growing my business."
74,"I am a New Orleans native who loves biking, meeting new people, and talking about mostly everything. I love hosting and traveling on Airbnb and I am your go to man for recommendations on eating, drinking and entertainment."
75,"Joel and Erin love travel and have embraced it as Airbnb Hosts and as Travelers. We're easy going, love hearing others stories and getting to know the area that we're in. As hosts, we love sharing all the beautiful things to see and do in Colorado Springs."
76,"I was born and raised in the Albuquerque area. I love hiking, biking, exploring and other outdoor activities. I plan on doing a lot of traveling in the near future and I plan on doing more BNB hosting."
77,"We are a family of four humans, one dog, five hens, a bee hive and lots of vegetables. We are artists, builders and crafters. We greatly enjoy welcoming people from around the world to our little homestead."
78,"I am an experienced traveler of many years. I travel frequently for work and fun. I meditate, practice yoga, study process work, work as a design researcher, service designer, coach, facilitator and UX researcher. I love tea, time in nature, and movement.  I would especially love to host international  travelers."
79,I'm new to the historic district of college park and I work in the technology field. I travel a lot with my companion friend Pahko. My free time is spent • doing outdoor activities • art & music• food
80,"I easy going, funny, intelligent, clean, live by myself in a 4 bedroom home. I'm a trained Chef and Sommelier and work as a licensed Health insurance agent with dental and vision as well. I drink occasionally, love cooking, play pool, darts which I have on property."
81,"I am a former lawyer, French major at Princeton, wife of an international businessman, world traveler and native Manhattanite. I am renting out a separate/attached/private unit, leaving you full independence with a separate entrance and total privacy, but available in the apartment next door for easy check-in at any hour and for helpful tips about NYC."
82,"I am a Huntington Beach native who loves living near the beach... other interests are NFL football (Go Steelers), huge sports fan in general, pizza and ranch, travel, & achieving goals."
83,"I am a native New Yorker who loves everything that the city has to offer.  The simple things in life make me very happy ... a nice cup of coffee, great ambiance and good conversation. I enjoy traveling, thrift stores, nice restaurants and hole in the wall restaurants."
84,"My husband and I recently retired to Tempe to be nearer all the amenities that a city offers. We are close to grandchildren, have one small dog, enjoy yoga, movies, books, sports."
85,Hello!! My husband and I enjoy meeting new people and visiting new places.  We are fur parents of a playful chihuahua named Daisy.  I am originally from Mexico and my husband was born and raised in San Antonio TX.  We love this city and all it’s beautiful places it has to offer.
86,I'm an actor and film producer. I try to be as accommodating as possible and give people the benefit of the doubt. I like making friends. I'm a superhero and a feminist.
87,"Hi, My name is Zewen. You can call me Grace. My favorite movie is Pixar Cars 1 (thanks to my son)I was born in Beijing, China and grown up in Minneapolis, MN.I love kids and animals. I hope to know more about my guests."
88,"Masters in Aeronautics, Undergraduate in computer science.  I worked as an engineer for largest engineering firm in world!  I am a consultant now (six sigma black belt) who works in process improvement for manufacturing.  I also develop curriculum to help kids become engineers"
89,My husband and I have been living in Southern California for last 31 years.  We have two grown up children soon to be settling in their careers.  I love to read books and gardening.  My passion is cross-stitching and crochet.
