profile_id,profile_text
706,I'm originally from Australia but call California home. I love anything extreme sport along with great food great wine and beer and great family and friends. I've been travelling the world since I was 19  and have never lost my love of new places and new experiences.
707,"My name is Julian,  I am a musician dedicated to Piano Jazz studies.  After spending a few years in South America, I am back to my home in Coconut grove"
708,I am a business owner.  I enjoy traveling for both business and pleasure. I prefer to stay at a home setting environment when possible. Thus me wanting to share my home with someone that feels the same way.
709,My husband and I are in our late 50's with two grown children.   I have been with American Airlines for 32 years and my husband has been in the construction field for over 30 as well.  Currently he is a plumbing superintendent for a large construction firm here in the Valley
710,"I currently split my time between Houston, LA, NYC,  and Lincoln, NE. In my day to day I manage portfolios of startup companies. In my pass time I enjoy cooking, exploring new restaurants and indulging in great conversations with people."
711,"Welcome to our house by Maria, Amy,  and Jing.I love kids. It is fun to stay with them.I would like to cook for my family and friends.I also enjoy my work with airbnb. I am happy to answer all your questions about our rental and Bay Area."
712,"I am a working class young man, courteous, friendly and like to host.I tend to give my guests their privacy but readily available for any assistance.Please feel free to make yourself at home as my guest."
713,"I'm a licensed Realtor in Georgia.  For 22 years, I have enjoyed working with clients who are serious about real estate. Dependable, honest, fair are just a few of the words that have been used to describe me.  I love living life to the fullest."
714,I am a fun and adventurous girl.I have traveled the world and stayed in many airbnbs and learned what is essential on a stay.So I would love to provide a comfortable stay to my guests
715,"My wife and I started using Airbnb to travel around the world, and then decided to purchase a few properties to share the experiences we have had. We also have full time jobs and two wonderful kids we love to spend time with. Our  favorite hobbies are spending time as a family on the weekends and travelling when possible."
716,Me and my wife travel for work. We are in  and out of town for business. We might be at the property at the time of your stay. I grew up in Denver Colorado.
717,"Hi, my name is Jenny. I have lived in Los Angeles for 30 years, I love reading and exploring nature. I am a student nurse andI'm currently listing a 3 bedroom house that is available on Airbnb because I enjoy meeting new people. My family is ready to welcome you as our guest(s) in Los Angeles."
718,"I am known for my big out going personality and i looooove to sing. I enjoy camping, hiking and most outdoors activities. I live close to national whitewater center so i spend most weekend rafting, zipping etc. I have plenty of space so if you're in the area feel free to book me."
719,"I'm a down to earth host looking to not only give you a pleasant stay in Charlotte, but to give you an experience to want to come back! I love meeting new people, networking, and enjoy hosting everyone from around the world!"
720,Love to travel and see the world from a local perspective. And I really enjoy meeting and hosting people on their adventures! I've had nothing but fantastic experiences since using this app. Wonderful guest and hosts!I can't wait to meet you!
721,I am married for 49 years to a wonderful guy. I have 4 grown children and 5 grands with 6th on the way. I just retired from teaching elementary school after 35 years. My husband is a writer. We are friendly and will try to accommodate you any way we can. Just let us know.
722,"I love traveling and meeting new people, I understand what it feels to be away from home and try my best to make my guests feel as welcome as possible."
723,My husband and I are so excited to be a hosting with Airbnb.  We believe you will love our cottage and the neighborhood we live in.  We are located in the heart of East Memphis and minutes away from everything.
724,"I am Visually Challenged and live day to day with the assistance of my faithful guide dog Jake, I am also a 30 year Licensed Massage Therapists, can provide massage separately, call for fees and scheduling. I’ll provide you Southern Hospitality at its best.."
725,"Me and my husband are the owners of this nice, cute and peaceful apartment. We don't have pets or kids so the all house is mostly quiet.When we are at home we have fun watching movies or series on TV.Welcome to stay in our apartment!"
726,"I'm a family and career woman who likes to travel. I became an owner of a vacation club and usually share my condos with friends, but recently decided to extend them to others to make vacationing more comfortable. Why rent a standard hotel when you can have a fully furnished and equiped condo?Thanks for checking out my page!"
727,"Originally from DC, migrated to ATL, NY, SF, then found home in Seattle. Love the outdoors and positive vibes!I'm a bit OCD about cleanliness so I hope you like clean rooms :)"
728,"I am an amazing people lover who loves life! And my job here at Airbnb is to make sure you are happy, comfortable and safe during your stay with us. Never hesitate to reach out to me for anything that you need. My guests are #1 Hope to see you soon!-Kirsten"
729,I am 34 years old ~ enjoy meeting new people and traveling around the world. I love New York  and take great pleasure in hosting people here at my place. I have a 6 bedroom house here in the West Village  and host guests in individual bedrooms as well as separate apartments.
730,"My wife and I live in the Seattle area.  We recently bought a home in Hamilton, Montana to be closer to kids/grand kids and skiing.  We enjoy meeting new people and seeing new places."
731,"Hi, everybody!I love airbnb and   love meeting new people.Don't hesitate to ask any questions. I do my best to provide you a pleasant stay in my house!"
732,"Energetic business person and CPA.  Favorite travel destination is Phoenix area.  Own two houses there.  As a host, you'll find my properties immaculate and comfortable in well-maintained, safe neighborhoods.  I care for and treat others' property as I would treat my own and expect the same from my visitors."
733,I'm an easy going guy with a curious mind who loves to meet people with interesting perspectives on life and the world. I've traveled a bit around the world and have pleasant memories of meals and conversations.
734,"Jay and Michael are newly married, traveling through life and the world together.  Nice, respectable boys both of them.  Interests include old things, good food and fine wine, dogs, Lana, art museums, history, video games, antique shops, fashion, second hand bookshops.  Priorities:  eating delicious things not eaten before, seeing beautiful places not seen before, meeting extraordinary people not met before."
735,"I am currently at a place in my life where positive vibes and good energy radiate from my soul creating my inner peace. I love to travel, try new food, and meet new people. Everyone has a different story and journey and I am grateful for anyone who gives me a genuine conversation."
736,"Looking forward to hosting you and providing excellent service. I have been living in Tucson for 30 years, please contact me with any questions or if you need recommendations, our variety of homes in different locations will fit every budget. Kind regards, Florencio."
737,Hello! We are excited to share our cozy space with some new friends. Jeff and I have lived in Charlotte for about 6 years and love all the fun things that this city has to offer.
738,"Hello my name is Tony in mid fifties. Purchased this property in August along with some friends. Although our primary residence, we are both gone so frequently that we have opened for people traveling to Colorado. We go out of our way to make your stay as pleasant as possible. Thank you"
739,I love traveling and meeting people from different backgrounds. My goal is that one day my husband and I can own a 5+acre farm somewhere in Florida and live sustainably with our two lovely girls Youstina and Anastasia. We would love to host you in our home.Welcome!
740,"I am a retired firefighter from Phoenix that now owns a small business that I operate in Phoenix and Tucson. I own a second home here in Ahwatukee along with another home in a small town located in the Sierras of Sonora, Mexico."
741,"I'm from Austin, TX. I love to do outdoorsy activities like wakeboarding, snowboarding, hiking, camping, swimming, and pretty much anything to do with the sun. I also enjoy going to concerts, as Austin is the live music capital of the world!"
742,"I'm a full time professional musician, and founder and teaching artist of the Roots & Rhythms Cultural Arts Program, currently working with at-risk youth thanks to a grant from the city of Austin's Cultural Contracts division and the National Endowment for the Arts. I love playing host to travelers and concert goers."
743,"I love books, music, and living in New Orleans.  I'm a professor and much of my writing is on New Orleans history and culture.  We look forward to having you stay with us for your visit to our beautiful city."
744,"Family of 4, Dad is a helicopter pilot and Mom is a self made entrepreneur. We love to be outdoors and exploring. We enjoy trying new foods and experiencing new places. We can't wait to help you do the same."
745,"Hello! We are Arineh and Chris. We're an easy going couple who love to travel, ski, make pottery, and ride motorcycles. As Los Angeles natives we are excited to share our city with you!"
746,OK I'm a girl from San Antonio looking for adventure and the big wide world and I want to see different cultures and experience new things and get to know what people are in the US and other countries
747,"I'm kind and easy going full of life. By nature i am warm,easy going,very hospitable, welcoming, honest and trustworthy.  I also host airbnb. A Motivational speaker by profession, I travel a lot, explore and adventure. I like meeting new people from all over. Looking forward to meeting everyone♡"
748,"We are a non-profit executive director and an architect who thrive on creative ventures and being outdoors. We are very active in the Tucson community and know all of the best places to eat, hike, run, cycle, swim, do yoga, shop and just hang out."
749,"I am a musician working in Boston.  I love  hiking, reading, traveling and spending time with my family.  A few things I can't live without: Peet's in the AM, trips to Colorado,  and my cat, Ali."
750,"I'm a Scottish American that  has lived in 3 countries. I have a BS in biology. I love to travel, snorkel, and sail. My wife is a pianist from Korea."
751,"Easy going, busy family of five. Always glad to meet new friends from around the world and give suggestions and advice on your trip. Also, always glad to leave you alone to do your own thing."
752,"A trilingual person/Born in Seoul but raised in many different countries./Fashion design major student and freelance Menswear designer based in NYC. Love traveling, nature and respect to every culture. Love to talk and host you."
753,"I am Scottish, I've lived in Houston for 15 years with my Texan husband Sean.   I have a ceramics studio where I teach classes to kids and adults and I also make my own ceramics..I like going to see art exhibitions , photography, food and live music."
754,"Hi!My name is Aaron.I'm originally from CT but I've lived in Colorado for four years now.I'm a digital marketer and small business owner. I own a tiny cafe in Long Island NY, and I love cooking.I'm excited to meet new people, offer an amazing guest experience, and maybe even share a communal meal or two :)"
755,"Seattle native, loving to see the city grow! Long walks around the city with my chihuahua, pared with my other love, coffee makes living this close to the  city a good time!Ask me for best places to dine, see, photo ops, and coffee shops!"
756,"I have lived here now for over 6 years. I enjoy meeting new people, and sharing the beauty of New Orleans. I'm respectful and flexible with all of our guests and do everything I can to make their stay enjoyable and memorable."
757,"Hi! My name is Gaisar. I am a professional snowboarder and an entrepreneur. I've traveled a lot around the World and the USA. Now I live in the lovely city of San Francisco, California."
758,"Not born and raised, but I consider ATLANTA my home. Attended college and HS here at 2 of the best in the country! Very helpful for anyone new to town."
759,"We are a very caring and respectful family with two kids (7years and 3years) from Berlin, Germany. We love to travel and have made a lot of fantastic Airbnb experiences in the past."
760,"Married to Marilyn.  We have 2 adult sons; one in Seattle and other in Ketchum, Idaho.  We lived in Olympia/Seattle, WA. for 25 years; retired and relocated to Phoenix, AZ to learn to appreciate the rain."
761,"Hi there! My name is Tato and I split my time between California and Wisconsin. My passion in life is to create warm, inviting spaces for friends and family to come together and create memories. I truly hope this home provides that for you— and more! Please don’t hesitate to contact me for any reason. I love hearing from you!!"
762,We spend a great deal of time exploring the outdoors We have lived in many places including Paris  but are from California originally.  We love to travel and have spent a great deal of time both in the States and abroad.
763,"I'm Guillermo, I like to travel and as part of the Airbnb community I appreciate the importance of good hosting.  I am also a super host on airbnb at El Paso Tx. and I understand perfectly the expectations from a guest."
764,I am a host by nature.  I have always wanted to own a Bed and Breakfast and found that being an airbnb host is my nitch.  I love what I do and look forward to being retired from the Army to be a full time host.
765,"Hi! Our vision to give everybody an opportunity to live, laugh and love with those they value most. We are committed to providing a safe and clean home to anybody looking to work, explore or simply relax in beautiful Colorado."
766,"I'm a crime fiction writer, an artist, and a lazy gardener. But I never met a flower I didn't love! Husband Phil is a professional jazz guitarist and an avid golfer. Fiona is our 10 yr old Shih Tzu. She is non-shedding and is not allowed in the third-floor studio."
767,"I live in Phoenix. I am a Lifeline practitioner, qigong instructor and Independent Asea Associate.  I am also the owner of a happy little Cavalier King Charles Spaniel named Ona and a Bichon Frise and former circus dog (just kidding) named Bijou."
768,"Small Business Owner:Founder of Cmm Global Realty / Sr. Realtor in SF/CA,  enjoy traveling, golfing during my free time ! General Brokerage of Life & Annuities: Blue Life Insurance AgencyAIG, National Life, North America, Trans America, Yoya Financial & OneAmerica"
769,I am a native of Denver Co. I love to travel and I am always busy working and challenging myself and career goals. I speak English as well as Spanish and look forward to meeting great people on this new venture with Airbnb!
770,"I am a Lutheran Pastor, a community activist and an adventure lover.   I brew beer and make wine and love to cook.   I love to meet new people and learn from them."
771,"Lathen is a real estate agent and Anne-Marie is a CPA. We absolutely enjoy living in Portland!  We LOVE food, travel, the outdoors, and enjoying the city.  We've been at our house in West Hills/Hillsdale for about a year and we're grateful for Airbnb for giving us the opportunity to meet people from all over the world!"
772,"I'm an avid surfer, soccer player and I work in User Experience Design & Research in the San Francisco Bay Area. I've lived in Oakland off and on for 18 years, and feel very much at home here. Before that I lived in Hamburg, Germany. I look forward to meeting you!"
773,"I am a millennial that is living a life of peace and contentment and I would love to share the satisfaction of life, by hosting your stay at my AirBnB."
774,"My name is Melanie. I am from Northern Wisconsin originally and live in Minneapolis. I work in the sector of public health education and policy development to elevate minority health outcomes. I enjoy outdoors, adventuring, good food, music, and the arts. I don't have any pet or food allergies. I am laid back, friendly, clean and polite."
775,I am a young professional working and playing in the city. I play soccer for the DCFL among a few other co-ed sports teams in Detroit. I loved living in Lafayette Park and continue to explore more areas of the city. I hope you enjoy your stay here!
776,"My husband and I are both archaeologists who have come to New Mexico to enjoy the views and the exciting history and culture of the American Southwest. We enjoy traveling, meeting people, and learning new things.  We look forward to hosting you in the retreat we are creating. Bienvenidos!"
777,"Hello! My name is Grant and I love traveling the world, experiencing new cultures, and doing that with my wife who is a graphic designer and illustrator.We currently live in Austin, TX and work in the marketing, music, and design spaces."
778,"Hello! My name is Adam, I work for the state of New Mexico.I'm hard working and I will make sure I work hard to provide a safe and comfortable place for you and your family!!"
779,"I love meeting new people and greeting them to my homes. My homes are a reflection of my personality. I love surfing, hiking, playing chess and reading books.Looking forward to meeting you and welcoming you to my home."
780,"I'm a speech language pathologist, working in a school district outside Albuquerque. I've lived in Albuquerque most of my life. My fiancé and I love ABQ and plan to continue our lives here. I love to sew, cross stitch and crochet!"
781,"Born and raised San Franciscan who loves to travel, meeting different types of people and learning other cultures while traveling. I enjoy trying all types of cuisines, and experiencing new exhilarating outdoor and indoor adventures."
782,"Hi, I am Interior Designer and love to design the space.  I hope you like it and feel like home from your home... This is the Best location in the town We will be happy to have you! ~ Marita"
783,"Hi! My name is Brett, and I am committed to providing you an AirBnB experience unlike any other! Whether you are looking for a quiet getaway or a fun-filled family adventure, I am here to make your time in Oklahoma City memorable."
784,"Travel is fatal to prejudice, bigotry, and narrow-mindedness, and many of our people need it sorely on these accounts. Broad, wholesome, charitable views of men and things cannot be acquired by vegetating in one little corner of the earth all one's lifetime.   --Mark Twain"
785,"My husband and I have lived in Puyallup, WA for 50 years and raised 3 wonderful children.  We love to garden, camping and traveling to Arizona to soak up the sun."
786,"Hmmm. Where do I start ? Im a proud dad with three children, other than work, I spent most of my time taking my family traveling and visiting many different places. I love to meet people from all over the places as well as trying out new food. My life motto: stay fit, eat healthy, and live happily."
787,"Hello! We are originally from Russia. We moved here more than 20 years ago. It's been a fun ride! Activities we enjoy: travel (of course), reading, photography, cooking, hiking/geocaching, soccer.We are looking forward to meeting you and we'll do everything to make your stay with us relaxing and enjoyable!"
788,"A native Bostonian, I can fill you in on the city's history and what's happening now - or not - depending on what you need and want while you're here.  Come visit!"
789,"Hi Everyone, my name is Wayne Linn, I am a professional property manager. Me and my co-wokers are Airbnb Superhosts for the past few years. We are well experienced in hospitality & work as a team to provide the best service we can to all of our guests! Looking forward to see you All !!!大家好,我叫林韦恩,我们公司专门负责民宿运营,并且有着非常丰富的经验｡在这里我和我的团队非常荣幸的能给大家提供最优越的住宿体验,并且让大家入住的物超所值!如果有任何需要,请随时与我联系!也祝你们有个愉快又美好的旅程!"
790,I have been selling real estate in the Devner and surrounding area.  I also broker telecom and Energy and when I do I feed hungry children in the United States.  Check out my web site at www.   (Website hidden by Airbnb)
791,"Busy, busy, busy.I'm a self diagnosed workaholic, so I'm actually not home much at all. Good if you're the type who like to have the place to themselves, not so good for the social travelers. I'm easy going and also readily available to answer any questions you may have."
792,I grew up in San Diego but currently live in Canada.  Owning airbnb property gives me an excuse to visit San Diego all the time but when I'm not there my amazing mother makes sure that my guests are happy.
793,"Easy going, friendly host!  I live close to the property as well as the housekeeper, so we can be there with any requests you may have or need very swiftly!"
794,Director for O’Casey’s Boutique Inn and the Bonner Gardens.  I love hospitality and have been in the industry for over five years now.  My goal is to make everyone feel like they are home away from home.
795,"I'm a wife, mom, entrepreneur and writer. I live on coffee, a good glass of wine and inspirational quotes.  I love Lee’s Summit and all the local charm it has to offer."
796,"a professional semi-retiring, well educated and well traveled the world.a person very caring and helpful, enjoy gardening, outdoors and traveling...the house is very clean and organized, very quiet and comfortable with respects. love good food and classic music. Hope everyone will have good time here."
797,"My name is Rocio. I grew up in Costa Rica. I am the third child. I was always mature for my age. Even with my own friends often annoyed me during my adolescence years. I love outdoors, I am very spontaneous."
798,"Adventurous traveler, Karma enthusiast, Coffee aficionado, Bonsaï admirer, Koï lover, Farm to Table evangelist, vinyl record collector.I am a very independent, relaxed and respectful guest and look for the same qualities when hosting."
799,"Miguel Gonzalez is a young entrepreneur having received his bachelors in Mathematical-Biology, BS (2017) he went on his own having started his first business while still in College. Since then, Miguel has expanded his endeavors to Real Estate where he now focuses his efforts on Espacio,  a temp stay hospitality company."
800,Hello! iv'e been living in San Antonio for about 14 year now. I love my city!I've been traveling all over the world and know how important it is to come on a vacation and to be able to feel like you are home.  Any questions just ask :)
801,I am a licensed structural engineer who has worked and lived in Silicon Valley with my wife and 2 kids for over 20 years. I got my Ph.D from Purdue University and am an inventor with five patents.
802,"I'm a writer, design nerd and barrio dweller. I love creating comfortable, beautiful spaces. As a teenager growing up in Door County Wisconsin, I worked at a bed & breakfast inn - one of my favorite jobs, ever - so having my own little b&b feels like a return to beginnings!"
803,"Born and raised in Santa Fe NM. I have lived in 4 different countries so far. I love to travel and did so for a while. I am a Real Estate Investor here in New Mexico and also am a Realtor. I am honest, respectful, motivated, hard working individual. I love fishing and most outdoor activities!"
804,"Traveling should be a fun experience. I am happy to offer information about great places to experience in Austin. My goal as a host is to help make our guests as comfortable as possible. Consider me your personal concierge while visiting with us. In the words of Anita Desai, “Wherever you go becomes a part of you somehow.”"
805,"Internationally touring poet. Featured in magazines such as vogue, Elle, entrepreneur, and paper magazine. Detroit kresge fellow and recently opened up for Mumford & Sons. Laid back, ambassador for all of Detroit."
806,Recent addition to the Colorado community. Have had years of success hosting through Airbnb in various apartments. I feel this space is the best yet :) Can’t wait to share it with you. Hope you enjoy your stay!
807,"I'm a photographer. My husband’s a developer. We’re currently traveling and want to give folks visiting our place the true Austin experience. We love dogs, music and tech; our home reflects that.Check it out, and if you want recommendations on dive bars or tacos or just have a question about our place, hmu!"
808,"I am a retired teacher, and my hobbies are writing fiction and gardening. Each month I spend several days in San Francisco, and I like to go to museums to see art. It is great to have guests, andI'm available for an occasional cup of coffee and discussions about exploring the Bay Area."
809,"We’re Ted and Lori. Virginia Beach natives who enjoy the casual lifestyle and the community of friendship common to our diverse resort-area neighborhood. Our family of five is usually on bikes, at the beach surfing, or enjoying time with our neighbors. Lori works at a high school, and Ted owns a wealth management firm."
