profile_id,profile_text
-761,"Welcome to my hometown! Well-traveled,  easily surprisedDeath-bed memories  Peaceful  quietClean  family  home  Laborers' helpersMultimedia artistEducated, discerningQuestion-askerCompassionate \xa0 Order is the answer to all  questionsAsk to be\xa0 unopened Date-asked is the only reasonable response!Victory is now!Thank you!Lindy Wunston"
-760,I grew up in Fremont California and finally settle in Utah for all those she's got left to see.  I love my home state and my family loves Utah as well.   We look forward to hosting guests from around the country and the world.
-759,My name is Wayne. I'm a professional man & love life.  I believe it's all about the positives. I've done a lot of traveling in my life & I love all the different flavors of hospitality. I hope that you share that passion in the little taste of Texas we have for you to enjoy!
-758,Traveling through Europe. Expatriate in Brooklyn before moving to Nashville. Love music and music & hospitality.  I work hard to be a great host and also hard at hosting music events for my musicians.
-757,"I'm a small business owner and you can rarely have enough coffee. I like to entertain, cook and travel. My motto is , live each day like it's your last!"
-756,I'm a semi retired businessman that likes to hike and play tennis.  We have several rental properties on property and Airbnb is an easy way to make a little extra income while visiting family and friends.
-755,"I am English, living in Seattle WA, and love art, music, animals, travel and history of all sorts. I like having a 'traveling' life style of time spent in a lot of different places sharing time together. Look forward to meeting you!"
-754,"Hey, I'm a musician & real estate entrepreneur, raising my 3-year-old daughter and husband in the Pacific Northwest. We love coffee, hiking, horseback riding, and spending time in the woods."
-753,"I'm a Real Estate Broker and a Sex Addict! Love to travel and meet new people!I'm a true story guy!...Be well, have fun,  Enjoy life. Love  music, travel, love  classical,  play tennis  and going out with friends"
-752,I started hosting as a way to support my husband and my son. My husband is an electrician so the home is always functional. I am new to hosting and am happy to help out. We love we the new Airbnb! It's a new way of sharing experiences!
-751,"Brian and I are advertising professionals located in Atlanta, Georgia. We live close to Historic Earl Warren High School, a great location for students, and apartments within walking distance of our homes. Our passion for traveling, outdoor activities, our cute dog and a big smile are what drives the 5 of us together."
-750,"Educated, very pleasant, fun, and friendly. Working on learning to be a better host. Being an Airbnb host makes me feel like I'm creating for others who need a place to stay and are just a tiny bit sick of a hotel.  I look forward to meeting other nice people who have airbnb spaces."
-749,"John & Sarah are host to this place.  The Traveler Loft, also known as The Union Loft, is located on the ground level of the property.  Experience the thrill of traveling, the tour of our home, with spectacular views of Fort Washington and the Smithsonian Museum."
-748,"I am loving life, I love life. I go out there and live! I love going to church to get my strength! If anything ever happened to my husband, know that I was looking for his baby girl. I would never turn away a great friend, or leave my baby baby."
-747,"Business and technology professional living in Pasadena, California. Born and raised here in Pasadena, go bowling at 2am whenever i have an hour and 10mines for a charity. Love to travel but mostly in large groups.  All nice people."
-746,"Native San Franciscan & LMTI'm a busy 21 year old student/professional who loves to travel and run errands, whether for work or pleasure. I look forward to hosting you and making sure you have a great stay at my home."
-745,"Vaughn lives in Lafayette with his wife and two children. He also practices law and teaches law students the next steps for employment and life after graduation. In addition to law, he enjoys the outdoors and the United States Marine Corps."
-744,"My daughter, Christina, and I love to travel and love getting to know the people we meet on our travels. We love coffee and good food, so we often book simple, rustic accommodations. It is always a pleasure to host!"
-743,"I'm a middle-aged woman, who loves to travel and meet new people. I'm a Zumba and Pilates instructor, and love to spend time with my husband and the ones I love. I really like to give guests an enjoyable, comfortable stay."
-742,"I love travel and spending time with friends and family, plus long weekend getaways. I am a pretty busy mom, so I am happy to offer suggestions for great dining in and around the area, too!"
-741,"I am a mother of two, a realtor and an education educator! I love to cook, garden and travel. I love to swim in the ocean and travel to a beach as often as I can."
-740,"I'm a flight attendant and I love the great outdoors.  I enjoy going on trips with friends to the water, adventures in the mountains,  and living life with purpose.  In my free time, you'll find me doing fun projects around the house, cooking, spending time with my husband Kevin, and traveling for fun and relaxation."
-739,"This place was one of our favorite part of trip to Bali. Family, friends, snowboarding and surfing were in order here with a nice living space for time spent with friends and family."
-738,"I am a retired Airforce pilot. I am also a homebuilder. I love to work, cook and enjoy socializing. I am very outdoorsy and love to explore the world. I love music, culture and travel."
-737,"In many ways, when you travel, you are traveling to yourself. We have taken all the things we value in our own homes and combined them into someone else's cozy experiences. We hope that you find them a welcome escape from the city. This place provides much of that in the comfort and sense of community of a small town."
-736,"Hi! I'm Alex and I love traveling, exploring, cooking and hosting on Airbnb! I've lived in San Francisco for a few years now and feel super comfortable in my home. I love to cook, travel, hike, read, cook vegan or vegetarian, and love to host and be a role model for other travelers."
-735,"We are retired couple, with 2 young adults working on startup business. We enjoy to travel, as well as enjoy home-based fun adventures such as cooking, painting, running, biking and hiking. We have lived here for about 10 years and we know the area very well. We have a small dog and love dogs and travel."
-734,"Hello!!I'm Ryan!!! I'm an Arizona native who enjoys hiking, golfing, and spending time with family. I enjoy spending my spare time with friends and family getting to know people from all walks of life."
-733,"Global COO/CMO - O.co/EverybodyActs/YelpResiding at:250 W 100 3rd StreetNew Orleans, LA 70110Properties:6th Floor - Mr. Caruso & Co LLC5000 Riverside Blvd. #ANew Orleans, LA 70119"
-732,"Hi! First of all, I'm the host of this airbnb, and I work full-time in an elementary school teaching reading to 3rd graders. I'm always available and available for questions, but I am also a pretty hands-off host. I like to think that my home is welcoming, clean, and comfortable for my guests..."
-731,"I am an associate executive who spends a lot of time outside. My current passion is Travel. I've been to 14 different countries so far, and counting. I love seeing new sights and hearing people's stories."
-730,"I am friendly, kind and  productive.  I love cooking Indian food and Thai food.  And love to try different cuisines.  I am a social person and I enjoy meeting new people."
-729,I am originally from Italy. I have lived in Oklahoma since 1998. I grew up on a farm in Oklahoma City and I went to college in Niwot.  I love traveling and exploring the world.
-728,"We are young professionals who love to travel. We look forward to welcoming you to our place. We've rented out our home on AirBnB for several years now and as we kept our rentals classy and clean, we got to thinking: why don't we do the same for you?"
-727,"We have been married 24 years and we are living in Chicago, we enjoy traveling and we have a dog that we own, we love to host people in our place."
-726,"Janet is a Colorado native, and Melissa grew up in Louisville, KY. A bit of a foodie, we really enjoy hosting guests at our home and make sure they are comfortable, out of the way, and away from home. We would love to make their stay in Boulder as enjoyable as possible!"
-725,"Hi I'm Zach .  I live in Austin, TX with my wife and our two sons. I love to travel and stay in airbnb.  I also work as a child guidance counselor and coach at a small school."
-724,Hi I'm David. I was born and raised in San Antonio.  My team and I have lived in 45 different places in the last 25 years. We love this city and feel as though we have come home.  It’s a pleasure to host you at our home!
-723,"Hello! My name is Sandy. I'm 38 years old,I'm married and have a 2 year old toddler.I'm a mom to a high school sweet girl, and I own a small food truck.My thing is family so I look to be responsive to all of my guests."
-722,I'm a business owner in the hospitality industry. I love showing off the city of Philadelphia to the world.   I love traveling too and look forward to entertaining guests as often as I travel!
-721,"Hi, I'm Jane.  I LOVE Seattle. I take full advantage of it when I travel and love using the city to refuel when I'm sleeping.  I also love to hike, kayak, and ski. I'm laid back and good with people."
-720,"Up to 12 bedrooms available for vacation rental in San Diego! Location is the most important thing for you, please take note we are in a place easy to get around."
-719,"I am a mom of a six year old boy. I love gardening, exploring, and exploring. I am very outdoorsy, having a lovely garden in our gated backyard. We also have one attached guest cottage to our two & a half bedroom house available for you to rent."
-718,I recently bought this house and enjoy it as if it was mine and are always available to do anything to help out! I've gone above and beyond to ensure the home provides the best experience for our guests. Welcome!
-717,Been in Milwaukee for the past 15 years and still have a love for the city. Work in retail business and love the outdoors and diving in the lake when there is time. I'm a bit of a foodie so enjoy grabbing crazy food on the road and can recommend places to go!
-716,My husband and I love travelling and meeting new people.  We have one beautiful baby daughter and an older son.  My husband is retired and I'm a who likes to exercise regularly and I do yoga.  We’re happy to accommodate all types of guests and hope that you will stay with us.
-715,I am always open to make any improvements for the best customer care always coming my way. I am clean and respectful and will be there to take care of you and your experience. Have a nice stay !
-714,"We love being Airbnb hosts and we are very excited to meet people from all over the world. We believe we offer a great value for our guests and love meeting people visiting the city we love in this magical city in Phoenix, AZ."
-713,"Hi! I'm Dave. I'm a San Jose Bay Area transplant in the tech industry, and in love with this city. I'm also an experienced Airbnb Superhost from Seattle, so you'll see that I went the extra mile to make my properties feel right at home. I hope you enjoy your stay with us!"
-712,"I am a dear, friendly and caring wife, mother and sister. I enjoy working out in the gym, travel, cooking and taking photos of wild cats in the Columbia Basin of East New Orleans."
-711,Hello! I'm Verna and this is a lovely place to be staying for this lovely evening! I hope you will enjoy your stay and take advantage of every difference the city of Detroit has to offer including amazing restaurants and night life. Thanks for stopping by!
-710,"I love traveling, cooking (jambalaya!!), sewing, painting and enjoying all kinds of outdoor activities.  I am a part of a small arts collective in Houston called African Artists.We are passionate about food and drink, outdoor adventures, learning and we love to bring great talks with us when we travel."
-709,My daughter and I love to travel and enjoy hosting travelers. We have used airBnB services for numerous vacations and we truly enjoy living in a place where so many people from so many places come and experience the beauty and entertainment of the great city of Denver.
-708,"Art found on the walls are by Walt Disney, Woody Allen and Christopher Hampton.  Floral finds by Sue Cole and Ashleigh Rodgers.  We live on a hill side about ½ mile from the beach."
-707,"I am traveling, simple, hardworking, and involved in my community.  I love sports and fun.  My favorite activities are running, bicycling, snow skiing, tennis, and road trips.  Life is all about balance."
-706,"I am a native EMT. I work in Atlanta.  Being around people creates a different life experience for me. My love for the outdoors is in full swing, my BJJ (as a fighter) is completely healthier than it used to be and I have a huge love for the outdoors and scuba diving!"
-705,Gotta love being backpacking in the American West.  Mid 50's Grandparent; Plan to run a few 40 mile hikes to camp during the week and 250 mile hikes to backpacking trips when I can get to the mountains.
-704,"Rashad is a young entrepreneur focused on creating an 'unblended best of' product and service experience. He is also an Aussie Abroad-MBA graduate and an anesthesiologist. He loves traveling, everything from surfing to traveling to gardening!"
-703,"We're a couple from Portland, Oregon.  We love great wine and coffee and live in the Pacific Northwest with our  son, Queenie  B, and young  Labrador mix, Sam.  We look forward to hosting you and making your stay wonderful."
-702,"I have lived in Arizona for more than 30 years and  enjoy exploring my beautiful state. I am a mother of 2 wonderful boys, love to travel and to be outdoors.  My family is easy going, and enjoys time at the beach, my home, and in the mountains."
-701,"Hi! I'm a thin (5'2'), Fun loving and out going Business Associate that just loves getting out and about and I love interacting with new people.  I'd love to have you and have lots of suggestions for your stay in the different areas of Atlanta."
-700,"Hello!I enjoy traveling with my wife on whim, sometimes we do both vacations!  I also love experiencing the different cultures around the world and strive to travel as often as possible. I love hosting and being a host!"
-699,We love to travel and offer other bnb travelers a very comfortable and convenient place to stay when they visit Phoenix. I am also a Realtor in the Phoenix area and can provide many helpful tips to ensure your stay is a pleasant and memorable.
-698,"HiI'm Flor, a former executive at Abercrombie & Fitch . I currently run my own social media media marketing agency as well.I'm also a college student! I love basketball, music, and planning my life."
-697,My husband and I have been married for 31 years. We have 3 grown children. We travel often for business or just get away and enjoy life to the fullest.
-696,"Originally from Costa Rica I am living in sunny Santa Monica, California with my lovely girlfriend I'm a professional hairstylist ,and a mom of 2 beautiful girls.Traveling is what I love. My favorite way to travel is by car, light aircrafts can be my weekend luxury."
-695,"I'm a long time Tucson resident - originally from Jamaica, New York  and just moved to Tucson about 10 years ago. I love talking, cooking, traveling, and people of all walks of life.I'm also a rather quiet host and like to focus on guests with schedules which allow."
-694,"I am an Afghan living in Los Angeles with my husband, two sons and a daughter. We love traveling, sports, fashion and food... We live in a large beautiful house and we live together with family and friends."
-693,"I'm a big Twin Cities fan and love being near a beach for swimming and surfing. I'm a professional basketball and soccer player, and enjoy golfing and watching soccer games. I also love country music.  I also enjoy movies and am a diehard fan of 'Breaking Bad'."
-692,"I love traveling myself and am using Airbnb with some of my other properties. Airbnb helps us to take care of our hosts and take care of our guests, we love it"
-691,"I am a great host and a great person. Being a great host should give guests a reason to stay here. We will provide great accommodations, plenty of free company and best quality food and drinks available. Our focus is on the guest. We would go above and beyond to make sure your stay is fantastic."
-690,"Hi I'm Bojan and I'm a Phoenix native. I moved to Phoenix and filled my days traveling and visiting beautiful places, never expecting my life to become a career I love. I live my life to the best of my ability and hope you enjoy your journey!"
-689,"Hi, I am very interested in meeting people from all over the world who travel abroad in search of a vibrant and diverse environment. I have a room that I always consider myself as a guest and I look forward to being your host."
-688,"I'm a single mama of two gorgeous kids who are busy enjoying their lives. I've lived and worked all over the world and very passionate about what I do! I love to travel, eat gourmet food, and spend my life traveling more and doing more new things."
-687,Our long term vacation rentals are a safe and relaxing setting for travelers. We personally travel to enjoy vacation rentals and meet with clients and loved ones! We look forward to hosting you soon.~Sarah & Tony
-686,My husband and I travel as often as we can for business or pleasure. I am a Realtor and he is an Economist. We want to travel as much as possible and find new and interesting places to stay!
-685,"Hi, I'm Alina. I love travel and sightseeing and spending time with my family. I'm new to AirBnB but I'm looking forward to meeting guests. I'm also a public radio producer so I look forward to sharing my home with you!"
-684,I am trying to start and run a small business but have not made any money yet. I am 34 years old. I have lived in Las Vegas for 8 years now. I really love the city. If you stay in my place you have my word you will have a fantastic experience.
-683,My name is Kathleen.  I am living in Portland Oregon and in love with the wonderful city.I am a holistic horticulturalian with 5 acres of flowers in my backyard. I produce a fragrant herbal tea which my clients call magic tincture.  It is rich and exceptionally relaxing. I love this city and offer you a comfortable and lovely stay.
-682,"I'm a writer and a mom, living in Westchester Beach, California. I enjoy meeting people, dining out, and spending time on the water, with my husband, Gracian and our four young daughters."
-681,"Hello - I was born and raised in the Detroit area. I come from a large extended family and have travelled quite a bit throughout Eastern Europe. I try to travel at least once a year to a more inland area.I am an artist, highly sought after in my area for my artwork."
-680,"I am a father, my wife, Fiona, is a welder, our daughter, Natalie, is 11,  and our cat, who lives with us, if you need a hand.  We love animals, good coffee, designing architectural homes, eating out with friends, the beach, travel and experiencing new places."
-679,Born and raised in Las Vegas. Love to travel. Air BnB has enabled me to travel more the past few years than I thought possible. I appreciate the life style and lifestyle that all cultures and countries provide.
-678,"I love California!!  I am also very tall, so maybe not the ideal Airbnb host for everyone, but glad to share the joy of CA with guests, and I am very open to feedback!"
-677,"I'm a big camper who loves to have people around and love to share my space. A musician, I love the Sun and music.I'm in and out of this great city as quickly as possible, so I try to be a great guest!"
-676,"I am family and friends oriented. I love to travel, run marathons and spend time with my friends and family. When I am not traveling I like to work and practice physical therapy. Most of the time when I travel I will just be staying at the host house and traveling with my pets. I am very organized and clean"
-675,"Retired Canadian banker turned entrepreneur; born in Latvia and spent much of my life in Slovenia; born in Slovenia and living in San Francisco for the past 40 years; married for 37 years, more than forty years and five children; retired from the financial sector  (€6000 business).One of my hobbies is to ski and play tennis."
-674,"I run a travel agency called \\NY Travel. When I travel, I like to have my personal bed and I like to do my own laundry. When I am traveling, I like to shop in establishments that are clean and I like to do my own hair and makeup when I travel."
-673,"Hello, my name is Eric and I'm an adventure-seeking professional.I love being outside and I love to spend time with friends and family. I am serious and passionate about life. I believe in success and community and I believe that business can make people happy. If there’s something I can do to make your trip memorable, let me know."
-672,A guy from the South Bay who loves to travel and stays in a lot of fun air bnb places.I love good food and wine & movie at home as well as being with family and friends
-671,Love creating happy human homes.  I love where we live in San Francisco and love sharing it with travelers.  I have the world's best hostess skills and am always a shout if there's anything you need or want!
-670,"I am a 25 year old male and I live in El Paso, Tx, USA.  I work at Home Security Systems & I have a nice apartment, which I rent to people from all over the world on a temporary basis as well.  I like meeting new people."
-669,Hello there! My name is Kaitlyn. I live in the area with my husband and a friend. You are most welcome to stay in our guest room! Hope to see you soon!
-668,"Keith is in the RN / BSN program and originally hails from the Commonwealth of Massachusetts but calls New Hampshire home. He loves to run, hike and bike. As a RN he has successfully completed in 3 years and also participates in a pretty adventurous fitness regime and meets frequently with fellow Gaiters. Yup that's right, Gaiters."
-667,We have just purchased our 2nd home this year and already have made some renovations and additions. This has been our go to vacation rental and we wanted to give it to others to enjoy just as much as we did when we were staying at another property. You will love your stay with us!
-666,"I'm a single mom who loves to spend time with my 5 kids and traveling to visit family. When I'm not at home, I'm out enjoying the fun stuff that Las Vegas has to offer."
-665,"I'm a simple person, and I love to travel. I'd just like to tell you that my home is  very special because it is a cozy place.  I've added the most important things for Airbnb. Rooms, laminate floors, and energy efficient appliances. You have your own private entrance and privacy, very reasonable prices, and fresh food and drinks."
-664,HiI'm Ben.   We recently re-opened our long-term apartment on Airbnb.   It's about 3 miles from Key Biscayne and 7 miles from Key Biscayne...and there's always beach if you want to relax or swim and play.  We look forward to welcoming you and yours to our home!
-663,"Growing up in the northwesterly, Atlanta could be part of country music country. We went to vacation rentals like hot rods and had a DJ cruise our world listening to the remixes and trance. The best places for relaxation."
-662,"Our family does a lot of travel around the world, and love hosting in both public and private spaces, often inviting our guest to stay at one of our 2 comfortable AirBnB homes."
-661,"What do I do? I'm a Pharmacy Coach & ADHD Coach.I love running, biking, hiking, reading, spending time with family & friends. I love to explore & experience new places.I'm a Host to a lot of amazing AirBnB travelers."
-660,U.S. Consul. L.P. ? I have lived in Miami all my life and can advise you all things to do. I speak Dutch and English and am very passionate about travel.
-659,"I'm Yvonne.I'm a Miami native, and always interested in figuring out ways to explore Miami. I don’t have a car, but I do have a cat, dog and I always leave a note for my hotel to call me ifI'm busy or if I need anything!"
-658,"Hi!I'm an entrepreneur, living in Nashville, TN. When I'm not running my barbershop or working from home, you can find me relaxing at the beach, working out in my gym, or traveling (sometimes alone, sometimes with my wife). I love meeting new people and meeting interesting new places!"
-657,"My husband and I are always searching for the most comfortable, out of the way spot to rent. Renting thru an airbnb, we figured why not try it.  After sharing two places with various guests, we have found our way onto a new level of hosting. We hope you'll enjoy your stay."
-656,We are a professional couple with a very interesting home together.  We enjoy traveling and hosting and hope to enrich our guests and learn how much we can learn from them.
-655,"Hello, my name is Zaya (pronounced zaya)  and my husband and I love meeting people from all over the world! We have traveled quite a lot and do our best to create a pleasant experience while staying in our AirBnB property. We hope to see you soon."
-654,"I'm a US Airways Executive First Class traveler. Former construction manager and entrepreneur. Work in consumer products and my wife is a full time Secretary, public relations and business developer and provides corporate level contracts."
